{"completion_status":"not_started","form_id":"task171.EPIC-DEV-P28-DRY-HANDS-WITH-TOWEL.author-verifier","immutable_assignment":{"alternative_route_hypotheses":[{"description":"A still image of the towel around both hands may answer without the preceding sink context.","machine_status":"OPEN_REQUIRES_HUMAN_FULL_SOURCE_VALIDATION","route_id":"alt.p28.towel.single_frame","route_type":"single_frame_shortcut"},{"description":"Other sink and hand-drying sequences must be searched in the full source by a blinded reviewer.","machine_status":"OPEN_REQUIRES_HUMAN_FULL_SOURCE_VALIDATION","route_id":"alt.p28.towel.repeat","route_type":"same_source_recurrence"}],"answer_hypothesis":"A white towel.","claim_hypotheses":[{"claim_id":"c.p28.towel.1","human_validated":false,"text":"The wearer leaves the sink and dries or wipes both hands with a white towel."}],"evidence_hypotheses":[{"carrier_class":"dynamic_nontext_visual","evidence_id":"e.p28.towel.v1","human_semantic_validation_status":"NOT_PERFORMED","hypothesis":"A white towel is held around and moved over both hands after the wearer steps away from the sink.","interval":{"end_s":39.5,"start_s":36.5},"modality":"vision","record_references":["vision.seg.a2f1023ab698.context.000001","vision.seg.a2f1023ab698.context.000002","vision.seg.a2f1023ab698.fine.000008","vision.seg.a2f1023ab698.fine.000009"]}],"prescreen_must_be_completed_before_authoring":true,"question_hypothesis":"After moving away from the sink, what does the wearer use on both hands?","role":"question_claim_author_or_verifier","source_content_sha256":"sha256:a2f1023ab698f790430ed126f9fddfd9b0de6258f57f6f89cdfb0ab131f9cf8e","task153_plan_id":"epic-dev-task171-P28_103-task153-plan","task153_plan_sha256":"sha256:938d33ecda3d954f233c0a16259d1356fff2575d22f77f62cc84791f0b0ca8c9","task153_sample_ids":["epic-dev-task171-P28_103-task153-plan.sample-0001","epic-dev-task171-P28_103-task153-plan.sample-0002","epic-dev-task171-P28_103-task153-plan.sample-0003","epic-dev-task171-P28_103-task153-plan.sample-0004","epic-dev-task171-P28_103-task153-plan.sample-0005","epic-dev-task171-P28_103-task153-plan.sample-0006"],"task167_proposal_payload_sha256":"sha256:e40575a703eceedc622d6f2e575d968681444b83b5ed0b985546ea99c0f04a86"},"immutable_assignment_sha256":"sha256:fc348abaa6b70f126e337af550189d005ec823851fddb7d046c019a3a5568762","packet_id":"task171.EPIC-DEV-P28-DRY-HANDS-WITH-TOWEL","packet_status":"DRAFT_NOT_DISTRIBUTABLE","prohibited_outcomes":{"future_test_eligible":false,"gate_a_eligible":false,"h1_assigned":false,"h2_assigned":false,"human_gold":false,"minimality_assigned":false,"necessity_assigned":false},"proposal_id":"EPIC-DEV-P28-DRY-HANDS-WITH-TOWEL","record_type":"epic_dev_author_verifier_form","review_fields":{"alternative_route_checks":[{"finding":"not_recorded","item_id":"alt.p28.towel.single_frame","notes":""},{"finding":"not_recorded","item_id":"alt.p28.towel.repeat","notes":""}],"answer_check":{"finding":"not_recorded","notes":""},"claim_checks":[{"finding":"not_recorded","item_id":"c.p28.towel.1","notes":""}],"evidence_checks":[{"finding":"not_recorded","item_id":"e.p28.towel.v1","notes":""}],"full_source_recurrence_notes":"","general_notes":"","ocr_transcript_caption_narration_notes":"","privacy_notes":"","proposed_repairs":[],"question_check":{"finding":"not_recorded","notes":""},"safety_notes":""},"reviewer":{"completed_at":null,"reviewer_id":null,"started_at":null,"training_attested":false},"schema_version":"1.0.0","source_group_id":"P28","source_id":"P28_103","source_level_exposure_policy":{"excluded_future_roles":["blind_alternative_evidence_finder","blind_post_adjudication_saturation_auditor"],"exposure_must_be_recorded":true}}
