{"completion_status":"not_started","form_id":"task171.EPIC-DEV-P27-CLEANER-FROM-CUPBOARD.author-verifier","immutable_assignment":{"alternative_route_hypotheses":[{"description":"The later 1252-1268 cleaning/cupboard sequence may reveal the same products and action context.","machine_status":"OPEN_REQUIRES_HUMAN_FULL_SOURCE_VALIDATION","route_id":"alt.p27.cleaner.repeat","route_type":"same_source_recurrence"},{"description":"Distinctive bottle colors and package appearance may make the temporal opening/retrieval sequence unnecessary.","machine_status":"OPEN_REQUIRES_HUMAN_FULL_SOURCE_VALIDATION","route_id":"alt.p27.cleaner.appearance","route_type":"question_only_or_single_frame_shortcut"},{"description":"AST door/slam/cupboard observations may locate the event but do not identify the retrieved bottle.","machine_status":"BOUNDED_MACHINE_REVIEW_SUGGESTS_PARTIAL_ONLY","route_id":"alt.p27.cleaner.audio","route_type":"non_speech_audio"}],"answer_hypothesis":"A pink-and-blue spray bottle of cleaner.","claim_hypotheses":[{"claim_id":"c.p27.cleaner.1","human_validated":false,"text":"The wearer opens the lower cupboard beside the sink."},{"claim_id":"c.p27.cleaner.2","human_validated":false,"text":"The wearer retrieves a pink-and-blue spray-cleaner bottle and returns it toward the stove."}],"evidence_hypotheses":[{"carrier_class":"dynamic_nontext_visual","evidence_id":"e.p27.cleaner.v1","human_semantic_validation_status":"NOT_PERFORMED","hypothesis":"The wearer opens the lower cupboard, reaches inside, takes a pink-and-blue spray bottle, and returns toward the hob.","interval":{"end_s":1212.0,"start_s":1205.5},"modality":"vision","record_references":["vision.seg.3b843787ad59.context.000074","vision.seg.3b843787ad59.context.000075","vision.seg.3b843787ad59.fine.000300","vision.seg.3b843787ad59.fine.000301","vision.seg.3b843787ad59.fine.000302"]}],"prescreen_must_be_completed_before_authoring":true,"question_hypothesis":"After opening the lower cupboard beside the sink, what item does the wearer bring back toward the stove?","role":"question_claim_author_or_verifier","source_content_sha256":"sha256:3b843787ad5906fe48d6b440b305a4dd31346e9a1569211286b3705a3baa1c0d","task153_plan_id":"epic-dev-task171-P27_101-task153-plan","task153_plan_sha256":"sha256:044896463ede2a66e2ea1c9adc3c54e7066d71bded700562bade6dcb28391ba4","task153_sample_ids":["epic-dev-task171-P27_101-task153-plan.sample-0001","epic-dev-task171-P27_101-task153-plan.sample-0002","epic-dev-task171-P27_101-task153-plan.sample-0003","epic-dev-task171-P27_101-task153-plan.sample-0004","epic-dev-task171-P27_101-task153-plan.sample-0005","epic-dev-task171-P27_101-task153-plan.sample-0006"],"task167_proposal_payload_sha256":"sha256:268a3384db9341c779742098c6dc4448c873debd8f846af08a5087460d346ab5"},"immutable_assignment_sha256":"sha256:673fb484324f31f8c653c17a69e3d913cfba28b724a32fd8051c6065f0807d56","packet_id":"task171.EPIC-DEV-P27-CLEANER-FROM-CUPBOARD","packet_status":"DRAFT_NOT_DISTRIBUTABLE","prohibited_outcomes":{"future_test_eligible":false,"gate_a_eligible":false,"h1_assigned":false,"h2_assigned":false,"human_gold":false,"minimality_assigned":false,"necessity_assigned":false},"proposal_id":"EPIC-DEV-P27-CLEANER-FROM-CUPBOARD","record_type":"epic_dev_author_verifier_form","review_fields":{"alternative_route_checks":[{"finding":"not_recorded","item_id":"alt.p27.cleaner.repeat","notes":""},{"finding":"not_recorded","item_id":"alt.p27.cleaner.appearance","notes":""},{"finding":"not_recorded","item_id":"alt.p27.cleaner.audio","notes":""}],"answer_check":{"finding":"not_recorded","notes":""},"claim_checks":[{"finding":"not_recorded","item_id":"c.p27.cleaner.1","notes":""},{"finding":"not_recorded","item_id":"c.p27.cleaner.2","notes":""}],"evidence_checks":[{"finding":"not_recorded","item_id":"e.p27.cleaner.v1","notes":""}],"full_source_recurrence_notes":"","general_notes":"","ocr_transcript_caption_narration_notes":"","privacy_notes":"","proposed_repairs":[],"question_check":{"finding":"not_recorded","notes":""},"safety_notes":""},"reviewer":{"completed_at":null,"reviewer_id":null,"started_at":null,"training_attested":false},"schema_version":"1.0.0","source_group_id":"P27","source_id":"P27_101","source_level_exposure_policy":{"excluded_future_roles":["blind_alternative_evidence_finder","blind_post_adjudication_saturation_auditor"],"exposure_must_be_recorded":true}}
