{"completion_status":"not_started","form_id":"task171.EPIC-DEV-P27-UNWRAP-FROZEN-ITEM.author-verifier","immutable_assignment":{"alternative_route_hypotheses":[{"description":"The wrapper manipulation may be visually sufficient without audio.","machine_status":"OPEN_REQUIRES_HUMAN_FULL_SOURCE_VALIDATION","route_id":"alt.p27.wrapper.visual_only","route_type":"visual_alternative"},{"description":"Crinkling may indicate packaging but cannot identify that the same item came from the freezer.","machine_status":"BOUNDED_MACHINE_REVIEW_SUGGESTS_INSUFFICIENT_ALONE","route_id":"alt.p27.wrapper.audio_only","route_type":"audio_alternative"},{"description":"Wrapper text or package appearance may leak the object or action context.","machine_status":"OPEN_REQUIRES_HUMAN_FULL_SOURCE_VALIDATION","route_id":"alt.p27.wrapper.ocr","route_type":"ocr_or_package_identity"}],"answer_hypothesis":"They take it from the freezer and peel off or open its wrapper.","claim_hypotheses":[{"claim_id":"c.p27.wrapper.1","human_validated":false,"text":"The wearer removes a small wrapped item from the freezer."},{"claim_id":"c.p27.wrapper.2","human_validated":false,"text":"The wearer peels or opens the item's wrapper before walking away."}],"evidence_hypotheses":[{"carrier_class":"dynamic_nontext_visual","evidence_id":"e.p27.wrapper.v1","human_semantic_validation_status":"NOT_PERFORMED","hypothesis":"The freezer drawer is open and a small wrapped item is removed.","interval":{"end_s":1290.0,"start_s":1284.0},"modality":"vision","record_references":["vision.seg.3b843787ad59.context.000079","vision.seg.3b843787ad59.context.000080","vision.seg.3b843787ad59.fine.000320","vision.seg.3b843787ad59.fine.000321","vision.seg.3b843787ad59.fine.000322"]},{"carrier_class":"dynamic_nontext_visual","evidence_id":"e.p27.wrapper.v2","human_semantic_validation_status":"NOT_PERFORMED","hypothesis":"The wearer manipulates and peels away the wrapper.","interval":{"end_s":1299.5,"start_s":1292.0},"modality":"vision","record_references":["vision.seg.3b843787ad59.context.000079","vision.seg.3b843787ad59.context.000080","vision.seg.3b843787ad59.context.000081","vision.seg.3b843787ad59.fine.000322","vision.seg.3b843787ad59.fine.000323","vision.seg.3b843787ad59.fine.000324"]},{"carrier_class":"non_speech_machine_hypothesis","evidence_id":"e.p27.wrapper.a1","human_semantic_validation_status":"NOT_PERFORMED","hypothesis":"AST assigns crumpling/crinkling with a peak weight of 0.40372; human listening has not been performed.","interval":{"end_s":1300.0,"start_s":1292.0},"modality":"audio","record_references":["ambient.seg.3b843787ad59.context.000079","ambient.seg.3b843787ad59.context.000080","ambient.seg.3b843787ad59.context.000081","ambient.seg.3b843787ad59.fine.000322","ambient.seg.3b843787ad59.fine.000323","ambient.seg.3b843787ad59.fine.000324"]}],"prescreen_must_be_completed_before_authoring":true,"question_hypothesis":"Where does the wearer get the small item, and what do they do to it before walking back toward the sink?","role":"question_claim_author_or_verifier","source_content_sha256":"sha256:3b843787ad5906fe48d6b440b305a4dd31346e9a1569211286b3705a3baa1c0d","task153_plan_id":"epic-dev-task171-P27_101-task153-plan","task153_plan_sha256":"sha256:044896463ede2a66e2ea1c9adc3c54e7066d71bded700562bade6dcb28391ba4","task153_sample_ids":["epic-dev-task171-P27_101-task153-plan.sample-0001","epic-dev-task171-P27_101-task153-plan.sample-0002","epic-dev-task171-P27_101-task153-plan.sample-0003","epic-dev-task171-P27_101-task153-plan.sample-0004","epic-dev-task171-P27_101-task153-plan.sample-0005","epic-dev-task171-P27_101-task153-plan.sample-0006"],"task167_proposal_payload_sha256":"sha256:b0c0ff7f999d1fcb1e0e51a09144447764bc770989a90a02db36a7717e487e53"},"immutable_assignment_sha256":"sha256:3215fee7f3c3fcf311bc63bd8704e137f88968c4bfbd916bbdfd14f6f6ffc2d5","packet_id":"task171.EPIC-DEV-P27-UNWRAP-FROZEN-ITEM","packet_status":"DRAFT_NOT_DISTRIBUTABLE","prohibited_outcomes":{"future_test_eligible":false,"gate_a_eligible":false,"h1_assigned":false,"h2_assigned":false,"human_gold":false,"minimality_assigned":false,"necessity_assigned":false},"proposal_id":"EPIC-DEV-P27-UNWRAP-FROZEN-ITEM","record_type":"epic_dev_author_verifier_form","review_fields":{"alternative_route_checks":[{"finding":"not_recorded","item_id":"alt.p27.wrapper.visual_only","notes":""},{"finding":"not_recorded","item_id":"alt.p27.wrapper.audio_only","notes":""},{"finding":"not_recorded","item_id":"alt.p27.wrapper.ocr","notes":""}],"answer_check":{"finding":"not_recorded","notes":""},"claim_checks":[{"finding":"not_recorded","item_id":"c.p27.wrapper.1","notes":""},{"finding":"not_recorded","item_id":"c.p27.wrapper.2","notes":""}],"evidence_checks":[{"finding":"not_recorded","item_id":"e.p27.wrapper.v1","notes":""},{"finding":"not_recorded","item_id":"e.p27.wrapper.v2","notes":""},{"finding":"not_recorded","item_id":"e.p27.wrapper.a1","notes":""}],"full_source_recurrence_notes":"","general_notes":"","ocr_transcript_caption_narration_notes":"","privacy_notes":"","proposed_repairs":[],"question_check":{"finding":"not_recorded","notes":""},"safety_notes":""},"reviewer":{"completed_at":null,"reviewer_id":null,"started_at":null,"training_attested":false},"schema_version":"1.0.0","source_group_id":"P27","source_id":"P27_101","source_level_exposure_policy":{"excluded_future_roles":["blind_alternative_evidence_finder","blind_post_adjudication_saturation_auditor"],"exposure_must_be_recorded":true}}
