{"completion_status":"not_started","form_id":"task171.EPIC-DEV-P28-PEEL-POTATO.author-verifier","immutable_assignment":{"alternative_route_hypotheses":[{"description":"A clear still showing peeler contact may answer without the repeated stroke sequence.","machine_status":"OPEN_REQUIRES_HUMAN_FULL_SOURCE_VALIDATION","route_id":"alt.p28.peel.single_frame","route_type":"single_frame_shortcut"},{"description":"The AST scissors label conflicts with the visual action and is rejected as semantic support.","machine_status":"REJECTED_BY_BOUNDED_FRAME_INSPECTION","route_id":"alt.p28.peel.ast","route_type":"machine_label_route"},{"description":"Other vegetable-peeling or cutting sequences require a blind full-source duplicate search.","machine_status":"OPEN_REQUIRES_HUMAN_FULL_SOURCE_VALIDATION","route_id":"alt.p28.peel.repeat","route_type":"same_source_recurrence"}],"answer_hypothesis":"Peels it with a handheld peeler.","claim_hypotheses":[{"claim_id":"c.p28.peel.1","human_validated":false,"text":"The wearer repeatedly draws a handheld peeler over a potato while other vegetables remain on the board."}],"evidence_hypotheses":[{"carrier_class":"dynamic_nontext_visual","evidence_id":"e.p28.peel.v1","human_semantic_validation_status":"NOT_PERFORMED","hypothesis":"Repeated strokes remove the potato skin with a handheld peeler.","interval":{"end_s":211.5,"start_s":196.0},"modality":"vision","record_references":["vision.seg.a2f1023ab698.context.000011","vision.seg.a2f1023ab698.context.000012","vision.seg.a2f1023ab698.context.000013","vision.seg.a2f1023ab698.fine.000048","vision.seg.a2f1023ab698.fine.000049","vision.seg.a2f1023ab698.fine.000050","vision.seg.a2f1023ab698.fine.000051","vision.seg.a2f1023ab698.fine.000052"]},{"carrier_class":"non_speech_machine_hypothesis_rejected","evidence_id":"e.p28.peel.a1","human_semantic_validation_status":"NOT_PERFORMED","hypothesis":"AST strongly predicts scissors, but the bounded frames show peeling; the class is not used as answer evidence.","interval":{"end_s":212.0,"start_s":196.0},"modality":"audio","record_references":["ambient.seg.a2f1023ab698.context.000011","ambient.seg.a2f1023ab698.context.000012","ambient.seg.a2f1023ab698.context.000013","ambient.seg.a2f1023ab698.fine.000048","ambient.seg.a2f1023ab698.fine.000049","ambient.seg.a2f1023ab698.fine.000050","ambient.seg.a2f1023ab698.fine.000051","ambient.seg.a2f1023ab698.fine.000052"]}],"prescreen_must_be_completed_before_authoring":true,"question_hypothesis":"What preparation does the wearer apply to the potato while the other vegetables remain on the blue board?","role":"question_claim_author_or_verifier","source_content_sha256":"sha256:a2f1023ab698f790430ed126f9fddfd9b0de6258f57f6f89cdfb0ab131f9cf8e","task153_plan_id":"epic-dev-task171-P28_103-task153-plan","task153_plan_sha256":"sha256:938d33ecda3d954f233c0a16259d1356fff2575d22f77f62cc84791f0b0ca8c9","task153_sample_ids":["epic-dev-task171-P28_103-task153-plan.sample-0001","epic-dev-task171-P28_103-task153-plan.sample-0002","epic-dev-task171-P28_103-task153-plan.sample-0003","epic-dev-task171-P28_103-task153-plan.sample-0004","epic-dev-task171-P28_103-task153-plan.sample-0005","epic-dev-task171-P28_103-task153-plan.sample-0006"],"task167_proposal_payload_sha256":"sha256:c651ef70d04fc2ab27576d57afc5694b4a163944016862153f1996ba7b472fb3"},"immutable_assignment_sha256":"sha256:b550dd9d3bc3272bf316d4b6424ff9b52bb82b85c82b87332406670b01bf53ba","packet_id":"task171.EPIC-DEV-P28-PEEL-POTATO","packet_status":"DRAFT_NOT_DISTRIBUTABLE","prohibited_outcomes":{"future_test_eligible":false,"gate_a_eligible":false,"h1_assigned":false,"h2_assigned":false,"human_gold":false,"minimality_assigned":false,"necessity_assigned":false},"proposal_id":"EPIC-DEV-P28-PEEL-POTATO","record_type":"epic_dev_author_verifier_form","review_fields":{"alternative_route_checks":[{"finding":"not_recorded","item_id":"alt.p28.peel.single_frame","notes":""},{"finding":"not_recorded","item_id":"alt.p28.peel.ast","notes":""},{"finding":"not_recorded","item_id":"alt.p28.peel.repeat","notes":""}],"answer_check":{"finding":"not_recorded","notes":""},"claim_checks":[{"finding":"not_recorded","item_id":"c.p28.peel.1","notes":""}],"evidence_checks":[{"finding":"not_recorded","item_id":"e.p28.peel.v1","notes":""},{"finding":"not_recorded","item_id":"e.p28.peel.a1","notes":""}],"full_source_recurrence_notes":"","general_notes":"","ocr_transcript_caption_narration_notes":"","privacy_notes":"","proposed_repairs":[],"question_check":{"finding":"not_recorded","notes":""},"safety_notes":""},"reviewer":{"completed_at":null,"reviewer_id":null,"started_at":null,"training_attested":false},"schema_version":"1.0.0","source_group_id":"P28","source_id":"P28_103","source_level_exposure_policy":{"excluded_future_roles":["blind_alternative_evidence_finder","blind_post_adjudication_saturation_auditor"],"exposure_must_be_recorded":true}}
